{"authority":{"report_establishes_general_model_quality":false,"report_is_parent_or_source_evidence":false,"score_is_fixture_conformance_only":true},"case_results":[{"failure_count":3,"failures":[{"assertion":{"input_path":"claim.epistemic_state","op":"preserves","output_path":"claim.epistemic_state"},"code":"INT_EVALUATION_ASSERTION_FAILED","message":"failed to preserve claim.epistemic_state"},{"assertion":{"input_path":"claim.claim_maturity","op":"preserves","output_path":"claim.claim_maturity"},"code":"INT_EVALUATION_ASSERTION_FAILED","message":"failed to preserve claim.claim_maturity"},{"assertion":{"input_path":"claim.provenance","op":"preserves","output_path":"claim.provenance"},"code":"INT_EVALUATION_ASSERTION_FAILED","message":"failed to preserve claim.provenance"}],"id":"INT-EVAL-001","metric":"provenance_retention","result":"fail","score":0},{"failure_count":3,"failures":[{"assertion":{"op":"equals","output_path":"claim.epistemic_state","value":"unknown"},"code":"INT_EVALUATION_ASSERTION_FAILED","message":"expected claim.epistemic_state='unknown'"},{"assertion":{"op":"equals","output_path":"claim.claim_maturity","value":"UNKNOWN"},"code":"INT_EVALUATION_ASSERTION_FAILED","message":"expected claim.claim_maturity='UNKNOWN'"},{"assertion":{"op":"absent","output_path":"claim.authorship_confirmed"},"code":"INT_EVALUATION_ASSERTION_FAILED","message":"expected claim.authorship_confirmed absent"}],"id":"INT-EVAL-002","metric":"unknown_preservation","result":"fail","score":0},{"failure_count":3,"failures":[{"assertion":{"op":"equals","output_path":"claim.epistemic_state","value":"conflict"},"code":"INT_EVALUATION_ASSERTION_FAILED","message":"expected claim.epistemic_state='conflict'"},{"assertion":{"op":"equals","output_path":"claim.claim_maturity","value":"CONTESTED"},"code":"INT_EVALUATION_ASSERTION_FAILED","message":"expected claim.claim_maturity='CONTESTED'"},{"assertion":{"input_path":"claim.provenance","op":"preserves","output_path":"claim.provenance"},"code":"INT_EVALUATION_ASSERTION_FAILED","message":"failed to preserve claim.provenance"}],"id":"INT-EVAL-003","metric":"conflict_preservation","result":"fail","score":0},{"failure_count":4,"failures":[{"assertion":{"input_path":"claim.epistemic_state","op":"preserves","output_path":"claim.epistemic_state"},"code":"INT_EVALUATION_ASSERTION_FAILED","message":"failed to preserve claim.epistemic_state"},{"assertion":{"input_path":"claim.register","op":"preserves","output_path":"claim.register"},"code":"INT_EVALUATION_ASSERTION_FAILED","message":"failed to preserve claim.register"},{"assertion":{"input_path":"claim.scenario","op":"preserves","output_path":"claim.scenario"},"code":"INT_EVALUATION_ASSERTION_FAILED","message":"failed to preserve claim.scenario"},{"assertion":{"op":"absent","output_path":"claim.biographical_fact"},"code":"INT_EVALUATION_ASSERTION_FAILED","message":"expected claim.biographical_fact absent"}],"id":"INT-EVAL-004","metric":"register_satire_preservation","result":"fail","score":0},{"failure_count":3,"failures":[{"assertion":{"op":"equals","output_path":"selected_tier","value":"T1"},"code":"INT_EVALUATION_ASSERTION_FAILED","message":"expected selected_tier='T1'"},{"assertion":{"op":"equals","output_path":"capability_inheritance_used","value":false},"code":"INT_EVALUATION_ASSERTION_FAILED","message":"expected capability_inheritance_used=False"},{"assertion":{"op":"equals","output_path":"rank_treated_as_execution_sequence","value":false},"code":"INT_EVALUATION_ASSERTION_FAILED","message":"expected rank_treated_as_execution_sequence=False"}],"id":"INT-EVAL-005","metric":"mrs_interpretation","result":"fail","score":0},{"failure_count":3,"failures":[{"assertion":{"op":"equals","output_path":"decision","value":"block"},"code":"INT_EVALUATION_ASSERTION_FAILED","message":"expected decision='block'"},{"assertion":{"op":"equals","output_path":"failure_code","value":"INT_CROSS_MODE_BRIDGE_REQUIRED"},"code":"INT_EVALUATION_ASSERTION_FAILED","message":"expected failure_code='INT_CROSS_MODE_BRIDGE_REQUIRED'"},{"assertion":{"op":"equals","output_path":"bridge_is_evidence","value":false},"code":"INT_EVALUATION_ASSERTION_FAILED","message":"expected bridge_is_evidence=False"}],"id":"INT-EVAL-006","metric":"mode_boundary_discipline","result":"fail","score":0},{"failure_count":3,"failures":[{"assertion":{"input_path":"allowed_history_source_ids","op":"subset_of_input","output_path":"historical_claim_source_ids"},"code":"INT_EVALUATION_ASSERTION_FAILED","message":"unsupported item in historical_claim_source_ids"},{"assertion":{"op":"equals","output_path":"invented_history","value":false},"code":"INT_EVALUATION_ASSERTION_FAILED","message":"expected invented_history=False"},{"assertion":{"op":"equals","output_path":"omission_interpreted_as_false","value":false},"code":"INT_EVALUATION_ASSERTION_FAILED","message":"expected omission_interpreted_as_false=False"}],"id":"INT-EVAL-007","metric":"invented_history_penalty","penalty":100,"result":"fail"}],"derived_noncanonical":true,"evaluation_identity":{"contract":"ai/consumer-evaluation-contract.json","contract_sha256":"ba32a03b90ec2f35b6533292bb6cc671e3273ec85249b89ee67c9a50687a031d","evaluation_index_sha256":"3d2d79e12af4a4d305043b6b8e01815ec2a64c0c702457090ecc62297111c468","index":"evaluations/index.json","parent_identity":{"ark":{"artifacts":[{"git_blob_sha1":"1a4860543488357321e1aad24ce36266769c5f39","path":"ai/minimum-recoverable-substrate.json"},{"git_blob_sha1":"dc7ea8e37772e677ee09f0e3a1447c2700a74789","path":"ai/recovery-tiers.json"},{"git_blob_sha1":"9016cf8e6641d48e639fb69cd5ad7f98a02840b7","path":"manifest.json"}],"pinned_commit":"f2bbf149abb3f8ccbfed158176873d813b66b546","protocol":"QSOL-ARK","repository":"https://github.com/QSOLKCB/QSOL-ARK"},"substrate":{"artifacts":[{"git_blob_sha1":"6abd254957843f2a0d42066423a5689099f85b6c","path":"ai/epistemic-contract.json"},{"git_blob_sha1":"bdc57ae303c2ce5b8498e3867d15d1804a59ba30","path":"ai/manifest.json"},{"git_blob_sha1":"9c830b095f59bbd948bf9ea5a8b35127121a7d99","path":"ai/mode-contract.json"}],"pinned_commit":"60e8cfeefa859df375f9f4d2fdb735edb1249db8","protocol":"QSOL-SUBSTRATE","repository":"https://github.com/QSOLKCB/QSOL-SUBSTRATE"}},"parent_identity_sha256":"666dad736c1b92cec599f1a7fd9e852542419a638fd5083c409dd10e20b857e8"},"fingerprint_sha256":"30ae8b18ee65bf549515abdb92d171e636b5f8f2a8069a3c8798dfab436da941","metrics":{"conflict_preservation":{"kind":"score","passed_cases":0,"score":0,"total_cases":1},"invented_history_penalty":{"kind":"penalty","passed_cases":0,"penalty":100,"total_cases":1},"mode_boundary_discipline":{"kind":"score","passed_cases":0,"score":0,"total_cases":1},"mrs_interpretation":{"kind":"score","passed_cases":0,"score":0,"total_cases":1},"provenance_retention":{"kind":"score","passed_cases":0,"score":0,"total_cases":1},"register_satire_preservation":{"kind":"score","passed_cases":0,"score":0,"total_cases":1},"unknown_preservation":{"kind":"score","passed_cases":0,"score":0,"total_cases":1}},"protocol":"QSOL-INT/CONSUMER-EVALUATION/1","run":{"claims_execution":false,"execution_kind":"synthetic_conformance","manifest_sha256":"4234632ad185a8ee60d4950399a484db11ef0143065ae3d28e6298d1495a24f0","run_id":"synthetic-adversarial","subject":{"id":"qsol-int.reference.adversarial","identity_authentication":"not_claimed","kind":"reference_consumer","version":"1.0.0"}},"summary":{"failed_cases":7,"invented_history_penalty":100,"overall_score":0,"passed_cases":0,"positive_metric_count":6,"positive_score_average":0,"positive_score_sum":0},"type":"qsol-int-consumer-evaluation-report","version":"1.0.0"}
