{"authority":{"report_establishes_general_model_quality":false,"report_is_parent_or_source_evidence":false,"score_is_fixture_conformance_only":true},"case_results":[{"failure_count":0,"failures":[],"id":"INT-EVAL-001","metric":"provenance_retention","result":"pass","score":100},{"failure_count":0,"failures":[],"id":"INT-EVAL-002","metric":"unknown_preservation","result":"pass","score":100},{"failure_count":0,"failures":[],"id":"INT-EVAL-003","metric":"conflict_preservation","result":"pass","score":100},{"failure_count":0,"failures":[],"id":"INT-EVAL-004","metric":"register_satire_preservation","result":"pass","score":100},{"failure_count":0,"failures":[],"id":"INT-EVAL-005","metric":"mrs_interpretation","result":"pass","score":100},{"failure_count":0,"failures":[],"id":"INT-EVAL-006","metric":"mode_boundary_discipline","result":"pass","score":100},{"failure_count":0,"failures":[],"id":"INT-EVAL-007","metric":"invented_history_penalty","penalty":0,"result":"pass"}],"derived_noncanonical":true,"evaluation_identity":{"contract":"ai/consumer-evaluation-contract.json","contract_sha256":"ba32a03b90ec2f35b6533292bb6cc671e3273ec85249b89ee67c9a50687a031d","evaluation_index_sha256":"3d2d79e12af4a4d305043b6b8e01815ec2a64c0c702457090ecc62297111c468","index":"evaluations/index.json","parent_identity":{"ark":{"artifacts":[{"git_blob_sha1":"1a4860543488357321e1aad24ce36266769c5f39","path":"ai/minimum-recoverable-substrate.json"},{"git_blob_sha1":"dc7ea8e37772e677ee09f0e3a1447c2700a74789","path":"ai/recovery-tiers.json"},{"git_blob_sha1":"9016cf8e6641d48e639fb69cd5ad7f98a02840b7","path":"manifest.json"}],"pinned_commit":"f2bbf149abb3f8ccbfed158176873d813b66b546","protocol":"QSOL-ARK","repository":"https://github.com/QSOLKCB/QSOL-ARK"},"substrate":{"artifacts":[{"git_blob_sha1":"6abd254957843f2a0d42066423a5689099f85b6c","path":"ai/epistemic-contract.json"},{"git_blob_sha1":"bdc57ae303c2ce5b8498e3867d15d1804a59ba30","path":"ai/manifest.json"},{"git_blob_sha1":"9c830b095f59bbd948bf9ea5a8b35127121a7d99","path":"ai/mode-contract.json"}],"pinned_commit":"60e8cfeefa859df375f9f4d2fdb735edb1249db8","protocol":"QSOL-SUBSTRATE","repository":"https://github.com/QSOLKCB/QSOL-SUBSTRATE"}},"parent_identity_sha256":"666dad736c1b92cec599f1a7fd9e852542419a638fd5083c409dd10e20b857e8"},"fingerprint_sha256":"2641f2fa77e5a2e38aababe978ae42a13f730b86b5f69b2760e41311c8211b4b","metrics":{"conflict_preservation":{"kind":"score","passed_cases":1,"score":100,"total_cases":1},"invented_history_penalty":{"kind":"penalty","passed_cases":1,"penalty":0,"total_cases":1},"mode_boundary_discipline":{"kind":"score","passed_cases":1,"score":100,"total_cases":1},"mrs_interpretation":{"kind":"score","passed_cases":1,"score":100,"total_cases":1},"provenance_retention":{"kind":"score","passed_cases":1,"score":100,"total_cases":1},"register_satire_preservation":{"kind":"score","passed_cases":1,"score":100,"total_cases":1},"unknown_preservation":{"kind":"score","passed_cases":1,"score":100,"total_cases":1}},"protocol":"QSOL-INT/CONSUMER-EVALUATION/1","run":{"claims_execution":false,"execution_kind":"synthetic_conformance","manifest_sha256":"96e0d72b5769f53531c522ebc7c74323b4844ba23835c65662f78399abb3d1f1","run_id":"synthetic-conformant","subject":{"id":"qsol-int.reference.conformant","identity_authentication":"not_claimed","kind":"reference_consumer","version":"1.0.0"}},"summary":{"failed_cases":0,"invented_history_penalty":0,"overall_score":100,"passed_cases":7,"positive_metric_count":6,"positive_score_average":100,"positive_score_sum":600},"type":"qsol-int-consumer-evaluation-report","version":"1.0.0"}
